{
  "actions": [
    {
      "action_id": "supersede-add-0",
      "kind": "add",
      "payload": {
        "node": {
          "id": "X",
          "owner": "resolver:test",
          "question": "Choose replacement contract?",
          "route": "AFK",
          "scope": "in_scope",
          "state": "open"
        }
      },
      "sequence": 0,
      "target": "X"
    },
    {
      "action_id": "supersede-1",
      "kind": "supersede",
      "payload": {
        "replacement_id": "X"
      },
      "sequence": 1,
      "target": "A"
    }
  ],
  "authority": "proposal",
  "claim_id": "claim-A",
  "kind": "reconciliation",
  "proposed_map_digest": "d991809136a7091fab5bc7abf812fbbdb113580c22f11bb2139e5bd227ed959e",
  "resolution_id": "resolution-supersede",
  "schema_version": "1.0.0",
  "source_digest": "d7381ce8fdf962920283312e8306a03370280d280923986ac639a8da9eeef103"
}
