{
  "actions": [
    {
      "action_id": "unblock-invalidate-0",
      "kind": "invalidate",
      "payload": {
        "reason": "no longer blocks"
      },
      "sequence": 0,
      "target": "A"
    },
    {
      "action_id": "unblock-1",
      "kind": "unblock",
      "payload": {
        "blocked_id": "C",
        "blocker_id": "A"
      },
      "sequence": 1,
      "target": "C"
    }
  ],
  "authority": "proposal",
  "claim_id": "claim-A",
  "kind": "reconciliation",
  "proposed_map_digest": "fc37f59451ce2e8fb92a0de258898bbf1a16979538f864d268ec39eb1b968bdb",
  "resolution_id": "resolution-unblock",
  "schema_version": "1.0.0",
  "source_digest": "d7381ce8fdf962920283312e8306a03370280d280923986ac639a8da9eeef103"
}
